{
    "$schema": "file:///C:/Users/narcis.oriol/Documents/codearchitect/codearchitect_3/resources/codearchitect.schema.json",
    "type": "object",
    "title": "Macro",
    "vscodeIcon": "symbol-number",
    "modelType": "parent-object",
    "properties": {
      "$id": {
        "type": "string",
        "hidden": true
      },
      "$label": {
        "type": "string",
        "hidden": true
      },
      "visibility": {
        "hidden": true,
        "$ref": "./visibility.model.json",
        "const": "public"
      },
      "value": {
        "type": "string",
        "hidden": true,
        "modelType": "input-string",
        "const": [
            "macro",
            "enummember"
        ]
      }
    },
    "$link": {
      "tags": ["*", "macro"]
    }
  }