{
  "$schema": "file:///C:/Users/narcis.oriol/Documents/codearchitect/codearchitect_3/resources/codearchitect.schema.json",
  "type": "object",
  "title": "Typedef",
  "vscodeIcon": "references",
  "modelType": "parent-object",
  "properties": {
    "$id": {
      "type": "string",
      "hidden": true
    },
    "$label": {
      "type": "string",
      "hidden": true
    },
    "visibility": {
      "hidden": true,
      "modelType": "dropdown-select",
      "$ref": "./visibility.model.json"
    },
    "datatype": {
      "hidden": true,
      "modelType": "dropdown-select-tag",
      "type": "string",
      "const": ["types"]
    },
    "documentation": {
      "hidden": true,
      "modelType": "input-string",
      "type": "string"
    }
  },
  "$link": {
    "tags": ["*", "types"]
  }
}