{
  "$schema": "file:///C:/Users/narcis.oriol/Documents/codearchitect/codearchitect_3/resources/codearchitect.schema.json",
  "type": "object",
  "title": "EnumMember",
  "modelType": "parent-object",
  "vscodeIcon": "symbol-field",
  "properties": {
    "$id": {
      "type": "string",
      "hidden": true
    },
    "$label": {
      "type": "string",
      "hidden": true
    },
    "visibility": {
      "hidden": true,
      "$ref": "./visibility.model.json",
      "const": "public"
    },
    "dependencies": {
      "hidden": true,
      "type": "array",
      "items": {
        "type": "string"
      }
    },
    "scope": {
      "hidden": true,
      "type": "string"
    },
    "value": {
      "hidden": true,
      "modelType": "input-string",
      "type":"string"
    }
  },
  "$link": {
    "scope": "parent",
    "tags": ["*", "enummeber"]
  }
}